{
  "$schema": "https://media.githubusercontent.com/media/tman9590/Yard-Critters/main/schema.json",
  "name": "Yard Critters",
  "version": "1.0.1",
  "description": "SpeciesNet v4.0.3a crop classifier packaged for Scrypted custom-classifier backends.",
  "input": {
    "shape": [1, 3, 480, 480],
    "color": "RGB",
    "range": [0.0, 1.0]
  },
  "labels": "data/labels.json",
  "backends": {
    "coreml": {
      "config": "models/coreml/config.json",
      "config_url": "https://media.githubusercontent.com/media/tman9590/Yard-Critters/main/models/coreml/config.json"
    },
    "openvino": {
      "config": "models/openvino/config.json",
      "config_url": "https://media.githubusercontent.com/media/tman9590/Yard-Critters/main/models/openvino/config.json"
    },
    "onnx": {
      "config": "models/onnx/config.json",
      "config_url": "https://media.githubusercontent.com/media/tman9590/Yard-Critters/main/models/onnx/config.json"
    },
    "ncnn": {
      "config": "models/ncnn/config.json",
      "config_url": "https://media.githubusercontent.com/media/tman9590/Yard-Critters/main/models/ncnn/config.json"
    }
  },
  "upstream": {
    "project": "Google SpeciesNet",
    "version": "4.0.3a",
    "type": "always_crop",
    "license": "Apache-2.0",
    "url": "https://github.com/google/cameratrapai"
  }
}
